{
  "schemaVersion": 1,
  "metadata": {
    "changeId": "20260730-simple-page-form-fixture",
    "pageName": "登记渠道联系人",
    "family": "form",
    "templateId": "form.page-simple",
    "executionMode": "shadow",
    "validatedCombinations": ["form.page-simple"],
    "request": "运营人员从独立菜单进入渠道联系人登记页，完成必填项和手机号格式校验后保存。",
    "selectionReason": "没有需要保留的来源上下文，四个字段相互独立，使用独立简单表单页。",
    "assumptions": ["预览仅验证客户端表单校验与成功反馈，不写入真实渠道联系人数据。"],
    "ruleRefs": ["BL-TPL-003", "BL-TPL-005", "BL-TPL-019", "BL-INT-005", "BL-INT-006"]
  },
  "ui": { "system": "boss-ledger", "runtime": "react-antd-page-spec", "rendererVersion": 1 },
  "content": { "capabilities": ["form.simple", "form.stickyActions"] },
  "form": {
    "presentation": "page",
    "stickyActions": true,
    "fields": [
      { "key": "contactName", "label": "联系人姓名", "control": "input", "required": true },
      { "key": "mobile", "label": "手机号码", "control": "input", "required": true, "pattern": "^\\d{11}$", "patternMessage": "请输入 11 位手机号码" },
      {
        "key": "channel",
        "label": "所属渠道",
        "control": "select",
        "required": true,
        "options": [
          { "label": "线上收单", "value": "online" },
          { "label": "联营渠道", "value": "partner" }
        ]
      },
      { "key": "remark", "label": "备注", "control": "textarea", "rows": 3 }
    ],
    "submit": {
      "primaryLabel": "保 存",
      "cancelLabel": "取 消",
      "success": { "title": "保存成功", "message": "渠道联系人已保存。" }
    }
  }
}
